iteration	timestamp	hypothesis	status	score	baseline_score	delta	notes
0	2026-08-03T00:00:00+10:00	freeze score-versus-decode factorial	kept	0.7549	0.7549	0.0000	protocol frozen; no sealed access
1	2026-08-03T22:30:00+10:00	matched shared-head threshold control	kept	0.7754	0.7754	0.0000	precision=0.9444 recall=0.7444 lookup_recall=0.0000
2	2026-08-03T22:31:00+10:00	pairwise matcher repairs opaque identity ranking	discarded	0.7793	0.7754	0.0039	zero gate wins; lookup recall remained zero
3	2026-08-03T22:32:00+10:00	current-candidate count repairs under-selection	discarded	0.6761	0.7754	-0.0993	raw_exact=0.8350 recall=0.9075 but precision=0.7411 failed guard
4	2026-08-03T22:33:00+10:00	pairwise matcher stabilises candidate-count decoding	discarded	0.7220	0.7754	-0.0534	raw_exact=0.8252 precision=0.8130; unstable across seeds
